"","text"
"1","looks ok not like so durable will hv to use a while to recommend others of its worth"
"2","tried the current can be very powerful depending on the setting i dont dare to go higher but if go higher sure muscle will become sore and can see the effect faster"
"3","item received after a week looks smaller than expected can‚t wait to try"
"4","thanks works as describe no complaints not really expecting any life changing results but thanks"
"5","fast delivery considering from overseas and only tried once not sure about the results yet"
"6","fast delivery good service "
"7","got my order and it came well packaged have yet to try but looks good so far thanks "
"8","items received in a nice box have not used it yet hopefully it works"
"9","received in good condition tried so far so good not that bad "
"10","item doesn‚t work    asked me to send a refund  show a non working machine and deem not enough evidence    don‚t waste time buying  "
"11","fast great"
"12","ive tried it and it works as advertised"
"13","hub uses it muscle growth on the upper arm "
"14","well received fast delivery and yet to replace the old pads hope it works will update again once tried "
"15","product received packaging damage but the unit are working well satisfied with the purchased thank you"
"16","good "
"17","box was a little beat up and had a smell but overall nicely packed came w a guide manual too"
"18","fast delivery however the product casing was slightly dented‚"
"19","fast delivery prompt response the material is good exactly like the photo‚"
"20","product received was exactly the the same as photos impressed with the quality as well texture isn‚t sticky as with some rubber products definitely a good buy‚"
"21","the bands were individually wrapped and came with a waterprood bag and guide pamplet as well"
"22","can really feel it treating it as a massage device cant help you slim down without excercise the chip can be better improved"
"23","product is okay havent tried but hope its ok"
"24","great deal and delivery is fast  response from seller is fast as well will recommend to other buyers "
"25","was given a replacement pack because the one i had before was faulty thank u"
"26","received in good condition  will be using soon to see if it works well"
"27","received well packaged "
"28","good and fast delivery"
"29","have not yet tried box was silght damaged but the rest is still in tect so hopefully it works and thanks for the welcome instruction menual "
"30","no bad cheap  good recomended"
"31","just received havent try"
"32","nice product love it"
"33","received fast nice "
"34","fast delivery everything is operational hopefully it works "
"35","well received"
"36","looks good  but need to try out to see if work "
"37","tested to be working perfectly hopefully will help recover and strengthen from csection before i start lifting weights again"
"38","product received in good condition the electric shock from the ems is a great fit for the different muscles can feel the burn "
"39","the product is great love using it awesome and nice to use"
"40","received earlier than expected good packaging as if bought from shop vibration motion can be feel very satisfied"
"41","received well packed and very good condition will try and update again how it works for me thank you seller will definitely buy again to this seller "
"42","thanks for the item  "
"43","no bad use "
"44","item received and working only thing is the arm band doesnt stick well moden is already very strong dont dare try mode "
"45","item received as stated hope it works will try out soon thanks "
"46","good"
"47","fast delivery  looks legit as you can feel the effects when using "
"48","arrived in good condition will test out after charging the energy pads"
"49","item looks good good thing is its rechargeable"
"50","item received in good condition will try it out later"
"51","thnk u my order are recieved now"
"52","nicely packed thin pads strong frequency  hopefully can see the effects soon"
"53","product arrived in neatly packed package have tried for a few hours today and it worked the vibration can be quite strong user manual is simple and didnt explain the  modes but can be figured out good value for the price "
"54","item received in good working condition really enjoyed the muscle toner gear everyday worth the money"
"55","nicely packed in a box for full set look ok and will try it out hope it works"
"56","came and delivered with all the pads nicely packaged will use when in need d"
"57","recieve fast trying soon"
"58","package well received i have tried it waiting to see if theres any results"
"59","item is as described fast delivery am using it now its good in working condition as described"
"60","the delivery was fast i have not try but  quality is good i will buy again"
"61","thanks "
"62","ok fast delivery "
"63","received the product within a week is really fast box dented but is ok coz importantly are the contents received in good condition "
"64","received in  days after placed order super fast "
"65","items as describe but not sure how effective"
"66","i just got a electric shock with this thing wth its really bad"
"67","order received have yet to try will update after trying"
"68","strength is good with  mode excellent product "
"69","thank item get and satisfied "
"70","now i can trainzzz item delivered fast and easy to use well recommended seller"
"71","bought the full set received as described have to note that you need to buy additional gel pads as the prestuck gel pads will only last you approximately  week"
"72","items received all items looks very small compared to pictures in the ad listing "
"73","very good product "
"74","item well received thank you"
"75","do not like the fit so much very different material as compared to other design in the same brand "
"76","order received in  days my second purchase for this design  absolutely love the quality material and fitting of this and this purple color is gorgeous size m fits perfect for a usual nike sports bra sm"
"77","received the product fast and  super comfy quality is good even though   for exercising but it can be wear out as a simple top     photo is slightly filtered but the colors are true to seller‚s picture "
"78","soft not bad"
"79","thanks to the review by the ladies got m for me which is the sport size of s to m  good fit love the purple color "
"80","order took abt  days to reach me i usually wear s for tops so this fits well but the straps are a lil tight as i have pretty broad shoulders also bit difficult to put on and take off maybe i‚ll try m next love the material"
"81","well received "
"82","item received few days ago abdominal left and right parts not working vibration feedback to the seller but no result given "
"83","great product and customer service will purchase from this seller "
"84","items received well packed delivery is quite fast received within  week after order yet to try it hopefully it work well and show some result "
"85","box damage when received "
"86","fast delivery and the product is as like the photo displayed "
"87","comes with a bag and workout instructions perfect thank you"
"88","the band looks great tried the resistance and it feels good hope to use it soon"
"89","csnt wait to try them love the colours as well thanks for the quick delivery "
"90","great porduct delivert quite fast"
"91","received in good quality i like the colours  "
"92","fast delivery works well"
"93","receives the items in good condition and they are packed nicely in good packaging this item is good to use and this is my nd purchase and recommend to purchase"
"94",""
"95","product received in good quality  tried using it for the first time wow the intensity is really power by using  mins on my arms and abdominals i start to sweat already thanks for the wonderful product hope after using for  months can see some results "
"96","dint get the gel pad tho the rest as described "
"97","great works well"
"98","thank u"
"99","i like the length of the tank top nicely cropped but not too short the cup inside was a little too thick for my liking but the material is rly good for this price "
"100","though the paddings are rather thick item came in good quality and for the price i paid for it was a good buy "
"101","love the low back cutting "
"102","item well received have yet to try hope   nice thank u"
"103","cutest top ever"
"104","the padding is big but not an issue as it can be swapped out otherwise love the cut especially the back"
"105","looks pretty good feels thick as well yet to wear "
"106","love this just that the bottom area is kinda loose  it has an always lift at the back "
"107","fabric is pretty thick   good for yoga but higher impact exercises not really "
"108","gr but awkward lift at the back "
"109","brand on tag and bag is not mp like my previous purchases but good material "
"110","loving the backless sports bra feels like i can wear it on its own or with another backless crop top a little bit tight for my size but still able to fit "
"111","the purple looks a bit darker in real life still happy thanks"
"112","ordered on th june received on rd june th time purchasing and it is always a pleasant experience selected the wrong size and seller was helpful to amend my order satisfied thou would have preferred if the inside do not have a separated band i suppose it gives more support that way anyway"
"113","received in  days usually a nike sports bra size sm i opted m for this based on the measurements provided and it fits nicely love that the white color material is good and thick enough so it is not see through "
"114","repeated buyer fits so well and so cheap when bought during flash deal thank you"
"115","second time buying from moving peach this time not  satisfied with all items i like the cutting for this fit is fine too just that it comes with weird thick padding and is not so stretchy i don‚t like work out tops that are a struggle to remove "
"116","well received material is good thick stretchy and opaque "
"117","quick delivery and item looks exactly like photos great quality at such a low price i would suggest sticking to your usual sizing as l is way larger than any of the other tops"
"118","material feels good items are exact to the pictures  yet to try on though   thanks‚"
"119","love it niw using it"
"120","received the product within  days box was dented but product seems ok have yet to try it thanks to the seller"
"121","the product delivered as expected its good but just want to know how to get the gel"
"122","fast delivery and good quality its really working well it makes me sweat a lot what makes me more contented is that once you on itit will not shocked you its slowly working and u can choose how the level i love it the most among all i tried thanks seller i highly recommend you god bless"
"123","as advertised sturdy and worth the money "
"124","received in good condition yet to try to see if it works"
"125","well received box a little dented but all‚s good just thought that a full set came with the gel pads as well but i was wrong "
"126","product came in fast in goood packaging and waiting to try it out"
"127","well received but not yet try is working or not thank you"
"128","the delivery was quick the ab trainer has faulty but the seller will be providing a new set for me thanks  great service"
"129","well received "
"130","item received with great condition  star rate as promised "
"131","not bad this product "
"132","the left and right is not having vibration only middle part is working  the arm band stimulation also not having uniform distribution "
"133","came quite fast havent tried yet "
"134","item came very fast and in good conditions i will buy it always and again "
"135","item came in very fast and in good conditions i will buy again and again "
"136","good "
"137","a pad was not functioning as per normal however with the great customer support from the seller it brings trust to all consumer to purchase more from them the seller can guide on the troubleshooting of themuscle trainer and will send out a new defective parts to customerwaiting for the parts now"
"138","sound great of the product havent try yet hopefully got effect for my body fat burning "
"139","well packaged hope it works "
"140","product is good gel can be used for maybe  times will recommend  "
"141","gel is good and comfortable does not irritate my skin good"
"142","see nice let my friend try "
"143","item received as described and in good condition"
"144","great item"
"145","order received box was destroyed but item inside still nicely packed tried and could feel the contractions "
"146","good product really can feel a little sweaty i have used for three days still starting from low to high current however right side stronger than left so abs may turn out lopsided other than that i think must also control diet and workout this is just an additional measure"
"147","as it had stated"
"148","intensity is very strong only downside is the arm band is very short and cant cover the entire arm and may come off during use otherwise  is a good value purchase"
"149","received item yesterday tested the device and it is working great just that   a bit flimsy "
"150","very well packaged and the size is just nice worth the money "
"151","product is great however delivery man left at the door without informing "
"152","so pretty pink thank you for such a fast delivery will buy again"
"153","good buy  "
"154","material feels like styrofoam and the backbone of the roller feels like toilet roll not keen to use it not a good buy "
"155","item as described delivery took abit of time but understandable cant wait to use it "
"156","product is good quality and sturdy will definitely recommend"
"157","the roller arrived very fast even though the circuit breaker"
"158","received the item in great condition "
"159","love this colour foam roller was out of stock but seller replied promptly about the restocking date shipping was very quick too"
"160","item came as per described really good use  fast delivery highly recommended"
"161","fast delivery  works as it should"
"162","speedy delivery  minor cracks on the foam portion"
"163","delivery was quick despite the situation tried it works well really like the  different textures "
"164","this local delivery took longer than expected  saw tracking status updates order  may and received  may fine as i was not rushing   "
"165","fast delivery product as described user it on the day it arrived to ease my muscle ache "
"166","good massage foam roller is well built"
"167","delivery was really quick item came as described and its rly sturdy as well "
"168","foam roller was in excellent condition and arrived very quickly"
"169","delivery was fast  only  days and items is true to the picture of item  good quality  will buy again from this local buyer ‚"
"170","thank you for the fast delivery perfect size and color i recommend this product "
"171","lime green doesnt look too bad"
"172","bought it as a gift for a friend delivered straight to her she said   really useful after long bike rides‚"
"173","delivery took  days super fast considering the situation item well received thanks seller"
"174","fsst deliver will try if effectivehope so "
"175","item received in good condition and works very well"
"176","everything is packed nicely in a box and it is individually sealed it comes with a  head charger that allows you to charge  ems at the same time strong powerful ems with different mode good product"
"177","product was packaged really nicely seemed to work well after switching it on and testing it"
"178","item received in good condition and it is working in good condition u can feel the electric movement when applied "
"179","fast delivery"
"180","cant wait to use it good buy and price is very reasonable"
"181","tired using once it works it has many speeds and functions which is good‚"
"182","product received in great condition  thanks seller‚"
"183","items received yet to try hope it works well‚"
"184","fast delivery and good condition"
"185","originally ordered and received a blue grid roller cos the one i wanted wasnt in stock however the seller came to my place and made the change to what i wanted in pic awesomeness‚"
"186","thank you very satisfied with my order product is great n works well well packaged n speedy delivery by jt courier received the next day after i placed my order i use the bumpy one for my legs coz of long distance running and the smooth one for my lower back‚"
"187","received the item in good condition its firm and really kneads those achey muscles bought two rolls and comes with free delivery will order again if needed tks"
"188","delivery was so prompt i‚m surprised have yet to use it will purchase again if   good"
"189","very fast delivery and items also good"
"190","product works but efficacy unknown yet‚"
"191","seller was very prompt in updating on the product delivery tried and works perfectly well‚"
"192","product received earlier than anticipated the shopee status was indicating in transit size a lot different than expected  box was crushed on arrival have yet to try out but hope it worksthe arm strips looks very small and short seller is responsive one of the unit not working "
"193","shipment took longer than expected but it is becos of the covid situation so i can undrrstand"
"194","received in time seems to work ok however cannot feel any pulse from the additional wrap around sections that are attached to the main abdominal pad section aside from that works as described‚"
"195","looks good "
"196","fast delivery "
"197","super fast delivery  received faster than expected  great stuff"
"198","fast delivery was just expecting it would include a bag but overall   worth the price still love the color too‚"
"199","happy with my purchase "
"200","good thank you"
"201","good customer service although there are some problem after goods received but seller is responsible and make the replacement "
"202","fast delivery for the price it is this is pretty good tried and works well except the gel on the pads tend to be very difficult to peel off when u want to reuse it"
"203","havent tried it yet but got it in good condition hope it works"
"204","received item earlier than given date tried the product i think it will work gonna try for a longer period and see how it goes‚"
"205","received in good condition yet to try and i hope it works fine"
"206","it actually works i can feel my muscles clench hopefully it helps with my workout results"
"207","fast delivery tested ok"
"208","recieved havent tey yet hopefully it works for me "
"209","thanks for the item"
"210","thanks so much seller received  testedit works "
"211","on time delivery  product condition good and working well  "
"212","strong vibrations  it made my arms twitch  will use for a while and update  adhesive quite sticky‚"
"213","fast deliveredthanks i havent ‚ yetlook is good"
"214","tried strong vibration"
"215","came a little later than etabut understandable due to covid product works fineand can feel the muscles being clenchedalthough the one for the abs need to be set to a higher intensity to be able to feel it overall recommended"
"216","items received in good packaging and condition will try it soon n see what the result"
"217","overall okay dont feel much of the intensity but delivery was fast thanks"
"218","items well received have yet to try"
"219","packaged nicely"
"220","sticky pads not sticky after just one use electronics works just fine"
"221","working well my tummy is sweating will buy again when its spoil hopefully no so soon "
"222","good product "
"223","ahhhhhhh thisss isssss greatttt product i luv itvi tried working welll"
"224","just received the item in good condition nicely packaged have not try it yet hope it will be useful"
"225","this product is awesome i just got mine it works perfectly gonna get one more for my friend"
"226","good purchase working well"
"227","item received in good condition i found the size might be slightly too big for me make it harder for me to row around"
"228","accurate product works well"
"229","requested for the blue one and seller gave it to me thank you item was delivered promptly packaged properly and has no defects very satisfied with it "
"230","good product and received it quickly"
"231","satisfied with purchase  "
"232","super fast delivery"
"233","nice product fast shipping "
"234","good‚"
"235","very good service  delivery was super fast seller is responsive and responsible definitely will continue to buy from this seller again recommended"
"236","have yet to try but thank you for confirming the delivery and good service  thank you"
"237","thanks seller for the prompt reply and assist to shipped out my purchase on the next business day will use it together with my training and see hows the effect will be "
"238","received but yet try"
"239","received faster than expected work well "
"240","have yet to try"
"241","was great"
"242","good condition"
"243","i had recieved the goods is well package and the controller is working thanks"
"244","received well"
"245","works very well"
"246","product did not take too long to arrive tested and working perfectly as can feel the reaction on the muscles"
"247","received thru letterbox tested and can definitely feel something specially on high level not sure if it can accomplish what it claims but will find out soon enough adhesive gels would probably lose stickiness after a while though‚"
"248","it works  "
"249","yet to open just collected so far experience dealing with seller is good"
"250","received well with the pads wrapped up properly too charging the controllers to see if they work but overall satisfied with this purchase"
"251","pretty good easy to use hope it will be effective and useful"
"252","received in good physical condition cant wait to use this hope it works as advertised thank you seller"
"253","nice packaging fast reply hopefully it works"
"254","very good"
"255","good cs haven try out the item "
"256","well look nice  yet to try ‚"
"257","item received in good condition"
"258","fast delivery "
"259","ordered this only a few days ago  fast item came nicely wrapped looks good looking forward to use it‚"
"260","bright and nice orange colour fast delivery‚"
"261","received in good condition thank you seller for the prompt delivery ‚"
"262","delivery was fast and worth it for the price material is a little hard so it helps with back ache and soreness overall good quality and prompt delivery "
"263","fast delivery the foam roller is hard and‚of good quality highly recommended "
"264","my second purchase good quality and value for money fast delivery too "
"265","delivery was fast"
"266","package in good condition have yet to try it but im excited"
"267","box are dented oh why"
"268","good buy during flash deal "
"269","looks cute  all but back part rides up like some others said although sizing was right"
"270","the padding was thicker than those from other products and fitting around bust could be better "
"271","love the back of the design "
"272","the paddings are too thick and do not mold well especially on white colour shoulder straps are a bit short yet underarm hems gap a little "
"273","a good fit and quality material it is also very comfortable though the cloth is on a thicker side"
"274","fast delivery received as what shown but the bra site doesnt fit well on me maybe i don‚t have big boobs"
"275","received in  days quality is good  comfy "
"276","will got another type well fitted"
"277","ordered nd of november received on the th of june very satisfied with the top "
"278","shipping is fast once it reaches sg"
"279","material is nice and soft has a built in bra compartment i like it a lot "
"280","quite thick feels like swimwear "
"281","very good material comfortable and sizing is as described stretchable "
"282","good quality thumb up "
"283","tank top came with removable bra padding it was on the thicker side and weights a little so i swapped it out other than being a low  medium intensity bra tank this too could easily be a lounge wear basic top "
"284","major love the scoop back top plus the inner padding "
"285","nice bareback cutting could even pair it with nice pants or skirt to head out material is thick and sticks nicely to the body when working out "
"286","like this very much kg m fits me well  "
"287","m is too big for uk would suggest getting s instead so sad it feels so comfy but too big for me  "
"288","love it size just right"
"289","have yet to try but so far quality is good comes with a push up cups"
"290","usually an s for sports bras not very tight makes a better layering top "
"291","fast delivery within  weeks quality is really good too can double up as a camisole and work out top for reference am kg ‚ waist and usually an xss and s fits perfectly m would‚ve been too loose ‚ like another that i‚ve bought will recommend"
"292","soft quality and really nice product overall shipping is fast too"
"293","size too small and not expandable "
"294","bought it during flash sale and got  diff colours and sizes i‚m usually a uk  size m fits me better and size s is more body hugging which i prefer it to be looser   comfy to wear it as a lounge wear at home "
"295","initially thought material would be a little thin and not very good but its actually nice and sturdy and hugs the body just right "
"296","sizing fits well and material is decent not translucent at all will definitely order again "
"297","quality is good suitable for low impact exercises could be worn as casual wear too"
"298","bought this pair of tights for a friend who is uk fits perfectly"
"299","great tops can be worn outside as well note that the material is stiffer and thicker than usual so don‚t expect it to be as stretchable but good quality for sure "
