"","text"
"1452","received in good condition and waiting to start working with this "
"1453","the rope looks ok  yet to try  hope it can last longer"
"1454","its nice thank you"
"1455","fast delivery item is useful i recommended a few friends to buy as well "
"1456","good thanks for the free gift "
"1457","fast delivery itmes good quality "
"1458","bought multiple items and it took  weeks to arrive items ordered are correct have yet to use the resistence training tension still waiting for another package cos at point of order too many items in cart so had to separate to  orders"
"1459","not bad  tension is strong  good for exercise  "
"1460","logistics was surprisingly not as slow as expected product seems decent however i dont think it would last for long as the  bands are actually hollow elastic tubes "
"1461","received the item in good condition and with a cute key chain as a free gift thank you so much highly recommended with a  ‚"
"1462","no bad  can buy  thanks you "
"1463","looks sturdy tried it for a while looks like it will not break‚"
"1464","safe and good delivery thanks "
"1465","fast and prompt delivery products material doesnt feel like it can last and it feels like it might snapped anytime nonetheless thank you seller"
"1466","bought yellow love the colour tension not too strong but   ok for me"
"1467","fast delivery all items received just came in handy thank you"
"1468","not bad to start doing my exercise i can bring it out to this venue during my hike and use it here"
"1469","receive in good conditionit is quite useful to use it to train lower absthanks"
"1470","strong wan"
"1471","delivery was fast and my item came intact havent tried it yet hopefully it doesnt break after a few uses"
"1472","received with thankshope can be use a period of time"
"1473","its good for the price i been enjoying using it thank you seller "
"1474","good product for exercising your arms and price is good delivery took abt  weeks through roadbull"
"1475","item received in good condition  hope it works  thanks seller"
"1476","price is good but delivery take quite long but totally understandable fun equipment to train the arms while watching tv"
"1477"," "
"1478","good quality and now very easy to do some stretching when u lie down on the floor for situps leh raise etc "
"1479","recieved in good conditiongood qualityhighly recommendedand thank you for the free gift"
"1480","delivery took  week  it is quite stressful as it may snap anytime when pulling it broke after awhile when using"
"1481","fast delivery item was received in a week and it was nicely packed "
"1482","shipping was fast amazed that seller has so many varieties of items for sale items were all received in good condition"
"1483","good quality and fast delivery"
"1484","very nice and the quality is excellent "
"1485","awesome items good to help with my sit up  loves it so much"
"1486","took abt  week plus received items in gd conditions worth buying at this price thank you"
"1487","goodnicewill buy againgood quality"
"1488","thanks "
"1489","thank you seller"
"1490",""
"1491","thanks  "
"1492","thanks     "
"1493","thanks"
"1494","received item in good condition and in  weeks time good "
"1495","quality is great and shipping was relatively quick only thing to complain about is how the foam of the handles got squished but thats jst due to how soft they are tysm seller "
"1496","good product quality and fast delivery "
"1497","tried it and its good definitely will recommend my friends to this thumbs up "
"1498","fast delivery worth the price"
"1499","quality seems value for price"
"1500","fast delivery within  days in my letterbox  happy with my purchase length of rope easily adjust though the handle felt light but i think okay to put in some skipping weights"
"1501","item received in good condition properly pack delivered was okay "
"1502","packed nicely and fast delivery the rope is easy to adjust "
"1503","delivery super fast item in great condition thank you"
"1504","nice packaging and good quality service with fast delivery‚s"
"1505","super fast delivery worth the purchase will definitely get it again "
"1506","received quickly and in good condition highly recommended"
"1507","waited for a while acceptable quality at this price "
"1508","handle is slightly dented but still ok"
"1509","value for  thanks seller for the free shipping so cant complain for the  weeks delivery time"
"1510","eact to pic and length is okay thankyou so much seller   "
"1511","item received in good condition thank you  "
"1512","item received as per pictured good quality and durable "
"1513","fast delivery and good in condition thank you very much"
"1514","item received in good order"
"1515","comes as per picture easy to adjust "
"1516","excited to use this hopefully i can get fitter with the help of the skipping rope "
"1517","bought for my mom since she said she wants to start skipping but until now she also too lazy exercise so idk whether   good or not "
"1518",""
"1519","delivery was fast "
"1520","delivery was fast came within a week quality looks good enough for the price "
"1521","well received item looks good and the skipping rope is tanglefree like what it claims to be "
"1522","lightweight but too flimsy it does not give me a good experience skipping with this plus side is that it is easy to adjust"
"1523","great and niceeeeeeeeeee delivery is a little slow but item is in good condition "
"1524","surprisingly fast delivery adjustable length worth the price "
"1525","good thank you for the fast delivery item is well received and packaged well "
"1526","fast delivery the length of the rope is adjustable and the handles are comfortable to grip good buy"
"1527","worth buying it"
"1528","great buy worth the price super fast delivery thank youuuu "
"1529","good and sturdy material the adjusting is limited though"
"1530","order received  product in good condition  affordable price"
"1531","yet to try"
"1532","so so hurt if hit not recommending to buy  "
"1533","came as advertised the grip is really nice to hold satisfied hope it last me ‚Ï "
"1534","good material long enough for me to use it can‚t wait to use it to exercise "
"1535","i love the product i shall order it again and recommend it to my family "
"1536","fast delivery item received in good condition yet to try  worth the buy at this price thanks seller "
"1537","good product all received in order as what i ordered thanks "
"1538","item well recieved "
"1539","item is well received"
"1540","item came in good condition and fast delivery thanks"
"1541","fast delivery  item as described with bearing length is adjustable like it"
"1542","product as listed"
"1543","delivery was quite fast and overall worth the money"
"1544","received about a week after purchase looks good length is perfect for me don‚t even need to adjust haven start using but is worth the price and will definitely buy again if need in the future "
"1545","great "
"1546","it is easy to adjust however the space in the handle is not enough for the excess rope to fit not recommended for petite people trying this i am m bear in mind after using it for awhile it will twist itself up overall not a bad product handle is soft"
"1547","good quality recommended "
"1548","love it very quality skipping rope and adjustable as well recommended "
"1549","received in  days with good condition  thank you "
"1550","order arrived the following week item is as described thank you seller"
"1551","the ropes seems a little too short for me haven‚t try out w it yet "
"1552","delivery faster than expected but the item was damaged when i opened it for such a cheap item i didn‚t opt to ask for return as   a total waste of time otherwise the rope functions as intended happy with my purchase overall"
"1553","good rope grip is fine too tho idk how it can be adjusted "
"1554","good item"
"1555","quick delivery and item arrived in good condition hopefully durability is long"
"1556","good and easy to adjust rope length"
"1557","items received in good condition"
"1558","considered fast delivery and in good condition i like it and recommended"
"1559","product was delivered on time but was abit upset by the dent created on the handle are as seen in the picture not a big issues but kind of disturbed by it packaging was ship without a box only plastic "
"1560"," good quality "
"1561","pack well seems hardy hope   lasting"
"1562","came in a week in good condition looks like   of good quality"
"1563","received in good condition thank you seller for prompt response only buy if needed"
"1564","well received thank you for the prompt and efficient response overall looks fine "
"1565","value for money product specs are as advertised durability unknown as yet"
"1566","skipping rope looks good material also looks good delivery on a saturday perfect timing  definitely buy if u looking for good pair of skipping ropes"
"1567","good quality for the price and fast delivery will buy again "
"1568","ordered on the  receive on th product as describe  "
"1569","item received good product"
"1570","quality looks good yet to try but i guess it will do the work "
"1571","good quality for the price paid "
"1572","love this highly recommended smooth delivery "
"1573","good for the price adjustable and durable "
"1574","loving it getting  more for my cousin "
"1575","skipping rope is of good quality have yet to try it yet can‚t wait "
"1576","looks good shall try n see"
"1577","fast delivery "
"1578","good"
"1579","superrrrrr fast delivery thank you"
"1580","looks good "
"1581","fast and efficient delivery yet to open and try item but hope its good"
"1582","really happy with the purchase weighted and quality "
"1583","item came in as expected"
"1584","nice grip is very comfortable and length of rope is just nice for my height im m ty"
"1585","well received in good condition pretty good quality and lightweight "
"1586","rope looks sturdy and just like pic"
"1587","delivery took about  week very good quality like it can adjust length too "
"1588","ok rope for this price adjustment is easy excercise works ok with this rope"
"1589","good item fast delivery but item came with slight defect where the foam for the handle is damaged but   all right"
"1590","good value for moneyadjustable rope "
"1591","looks not bad for the price paid  "
"1592","item looks good length is long too"
"1593","long delivery time waited for more than  weeks  yet to try will further review thanks seller "
"1594","fast shipment within  weeks during cb rope is adjustable "
"1595","love it"
"1596","good skipping rope recommended for adults painful if misjump and whip yourself "
"1597","received through letterbox through singpost product is new"
"1598","good  fast delivery "
"1599","item received in good condition used it a few times it doesn‚t get tangled and i like that the handle is really soft "
"1600","item came as described delivery too quite a long time to arrive hopefully it serves its purpose"
"1601","quality is very light compare to crossrope the reason is there is no wire inside to add weight compare to the ads which indicates embedded wire but really dont have see rd photo maybe good for beginners who really never do jump ropes yet"
"1602","delivered in good condition product as per description and thumbs up for the delivery speed yet to try it out but should be worth the price paid"
"1603","received in good order and condition thanks "
"1604","fast delivery and good item"
"1605","overall good"
"1606","product is not tangle free but delivery came early thank you "
"1607","item looks goods have not yet try it hopefully it wont tangle and last longer "
"1608","received the item in good condition cant wait to try itthank you"
"1609","quick and efficient delivery took less than  weeks and product seems relatively sturdy‚"
"1610","good quality ropes thanks"
"1611","good   better than my old ropes "
"1612","love this skipping rope it was easy to adjust to my height and   great for beginners like me used it around  times so far and   durable would recommend"
"1613","nice for its price i was expecting more weight but still perfect for workouts"
"1614","goods received as described it was delivered by singpost "
"1615","looks very good hope it works and fast delivery too thank you"
"1616","looks durable and value for   quality"
"1617","okay received the product aft quite a long wait i guess cos of the current situation package is fine and all "
"1618","arrived quite fast but the rope is very long have to adjust before using other than that good for the price"
"1619","quality ok delivery ok service ok thank you "
"1620","good"
"1621","great quality  hopefully can last long "
"1622","item received in  weeks time and received in good condition "
"1623","got my item in  weeks and in good condition   great "
"1624","good "
"1625","fast delivery item received in good condition highly recommend "
"1626","got it during flash sales at  cents woohoo thanks loving the colour "
"1627","bought a black speed rope good quality and no regrets fast delivery as well"
"1628","bought during flash sale at  very worth it material is lightweight and looks sturdy"
"1629","ship from sg  received super fast quality looks good thanks seller"
"1630","looks good for me got it in flash deal good to have one of those thanks seller  fast delivery as well"
"1631","good fast delivery"
"1632","very fast shipping bought at flash sales highly recommended"
"1633","fast delivery items received in good condition "
"1634","fast delivery thank u so much  will be using this during this period"
"1635","ordered on  june received on  june the item was shipped out really fast while the quality is not the best   decent for the price"
"1636","great buy both are adjustable as well which makes it great for me "
"1637","quality is quite good and really light weight will take a while to straighten it out while jumping"
"1638","fast delivery good quality product bought during flash sale good deal"
"1639","nice bubble wrap and plastic wrap also double protection protection is always good right  anyways time to lose some weight haah "
"1640","fast delivery good product thanks will buy again if needed "
"1641","receive it  days later after placed the order nice service and will buy again next time if needed  "
"1642","fast delivery however the product quality is very bad too small no durable and hooks and screws can easily detach "
"1643","very very fast delivery  great product for such low price thanks"
"1644","fast delivery ordered on th and received on th tried and it works well length easily adjustable too "
"1645","works as it should no flaws "
"1646","fast delivering works well thank you"
"1647","received in good condition "
"1648","nicely package and fast delivery "
"1649","the rope was delivered in good condition the delivery came within a few days have yet to try it "
"1650","got the speed rope and   really worth the price "
"1651","both speed and training ropes lack weight did not enjoy the workout from these used to the weight from the decathlon ropes better   would not buy again"
"1652","item well received with thanks as per described have used it today  lightweight good to use and length is just nice "
"1653","nice products training rope is too short "
"1654","havent used item item looks cheap like not worth it"
"1655","good quality and material the delivery was fast despite covid"
"1656","good quality well received thank you very much so far no issues"
"1657","so far no issues received it today and am very satisfied "
"1658","order received in a shocked the status of order didn‚t update on the app hence this came to my surprise today "
"1659","bought the orange one cheap and good will be working out during this cb"
"1660","fast delivery item came as expected "
"1661","item was received inngood condition delivery was on time as well "
"1662","very very fast shipping item was also well packed"
"1663","the delivery is super fast i ordered yesterday i received it today yet to try "
"1664","i like the color and i can adjust the length of the rope the rope slowly twists while jumping then i have to straighten it again but considering the price i guess   ok thank you for the fast delivery"
"1665","got during flash deal and the delivery was very fast less than days "
"1666","item was well received delivery was quick and item was nicely packaged thank you for the deal will recommend to others "
"1667","rigorer training skipping ropes good quality and free delivery suitable for us  "
"1668","fast delivery and easy transaction and would be happy dealing with seller again"
"1669","received my order today super fast delivery ordered yesterday came todaythanks"
"1670","good glad that i got it on a flash deal "
"1671","product received in well packed condition good quality value for money"
"1672","item is in good condition its more towards speed rope as compared to the weighted ones overall good purchase "
"1673","its made of good material and in light weight thank you"
"1674","great rope"
"1675","delivery was incredibly fast item came in nicely packed and in perfect condition "
"1676","bought the ‚blue one its good and was delivered fast appreciate it"
"1677","delivery took some time might be due to covid  have not tried yet materials seem good "
"1678","order received as expected and delivered on time works really well"
"1679","received in good condition and despite covid the item arrive quite fast "
"1680","delivery and shipping was quick which is great but i shouldn‚t have gotten this version its quite uncomfortable especially if you‚re not used to it because the wires get wrapped around the handle when you‚re skipping but on the plus side you can probably change the handles to weighted handles"
"1681","item received in good condition and fast delivery  "
"1682","very fast delivery "
"1683","delivery was a bit slow probably due to being sent by normal post works well and easy to use "
"1684","item received in good package and conditiondelivery is fasthaven‚t try hopefully   good product"
"1685","the skipping rope works fine just that the delivery takes a longer while to arrive "
"1686","nice quality would recommend"
"1687","order well received in good condition and delivery time is relatively fast"
"1688","order is as described delivery is fast overall satisfied for this price point good buy "
"1689","great product that i got during a sale for only  value for money "
"1690","really like the quality of the rope but havent had one where the rope is heavier than the handles"
"1691","very light but not like those kids jump rope good for training and speed"
"1692","the rope is not as flexible as nylon and at this price ill accept this quality"
"1693","not bad good quality fast delivery as welljust nice for cb"
"1694","received item in good condition just only that shipping too a little longer probably due to the covid  issue personally i prefer the black steel wire ones"
"1695","good skipping rope nothing to complain about got it at flash deal might have cheaper ones out there since made in china"
"1696","rope is light and can be used easily seems durable and can be washed‚"
"1697","fast delivery parcel received  days after purchased"
"1698","received after  days upon payment light rope overall is good"
"1699","value for money "
"1700","item well received delivery was quite ok not a long wait"
"1701","good quality skipping rope that works well "
"1702","rigorer training speed skipping ropes good quality  good price  "
"1703","good quality products and quite light packaging with bubble wraps thank you "
"1704","brought this during flash deal reached within day from my purchase is consider fast"
"1705","good quality well received thanks so much will be using this at home"
"1706","thank you so much  appreciate the fast delivery and so far no issue"
"1707","item received in good order  nice rope tho a tad short for me"
"1708","great‚"
"1709","very fast delivery ‚product quality is  ‚∫Ô‚∫Ô"
"1710","item works well and the product came on time no regrets and might purchase again"
"1711","excellent quality rope for tricks and cardio"
"1712","good item"
"1713","product quality is fine delivery is average but a good item for work out thanks seller "
"1714","good i really like it and i will be using this at hkme to exercise"
"1715"," great fast delivery good quality i can do all the tricks with this jump rope thank you highly recommended "
"1716","a little small than what i expect but good quality it is very light too"
"1717","item received in good order the bearing was a little wobbly although i cannot confirm if it was because of my technique or the route itself"
"1718","looking great cant wait to try it out"
"1719","good quality‚"
"1720","little bit long but still great just had to tie a knot exact to pic‚"
"1721","great purchase prompt efficient delivery by seller  thanks for the excellent quality  affordable ropes "
"1722","as described well packed good shipping will buy again "
"1723","love the product seller was responsive and friendly ‚provided advice towards my questions item was shipped out fast too despite cb will purchase from seller again"
"1724","received in good condition quality looks promising‚"
"1725","suitable for beginners price is right  "
"1726","good sturdy skipping rope delivery took a reasonable amount of time because of the current situation good purchase"
"1727","good quality items received per described"
"1728","amazing and fast delivery the length is just right  i am m "
"1729","light and bright colour the kids love it thanks"
"1730","awesome tks "
"1731","awesome item def value for money "
"1732","delivered as described good quality and easy to adjust length of the rope great addition to workout during this period"
"1733","feels like a cheap skipping rope not worth like  that i paid ‚can get cheaper better ones‚"
"1734","super fast delivery love that it is very lightweight the colour is nice too"
"1735","fast delivery but handle seems very thin and fragile but worth it for the price  "
"1736","fast delivery received in good condition item works and looks great"
"1737","fast delivery havent tried it but overall quality is good for the price  thank you "
"1738","i have not received the item even after almost  months "
"1739","very fast shipping and superb quality"
"1740","light weight and easily adjustable arrived quickly considering circuit breaker thanks‚"
"1741","beautiful professional service legit thank you"
"1742","very fast and prompt"
"1743","product came quickly and as advertised we bought the  different types which worked well "
"1744","super fast delivery have yet to try the rope yet but received it in a good condition"
"1745","received in good condition  works well thanks seller less than  i paid‚"
"1746","very fast delivery the training rope look nice the length is okay great deal might purchase again in the future"
"1747","item as describeas pictured   great i‚ve been incorporating skipping in my workout to lose weight very affordable way to stay healthy "
"1748","thanks so much good quality will be using this to skip at home"
"1749","thank u for this good quality and decent delivery time esp with covid"
"1750","thank u relatively fast delivery despite covid excited to start doing cardio at home"
"1751","very fast shipping despite current situation thank you"
"1752","fast delivery thank you so much bought  and ill be using them "
"1753","ok for the price but can be better quality "
"1754","bought  black speed rope and blue training rope fast delivery and both are of good quality "
"1755","good quality and fast delivery thanks for this"
"1756","good rope fast delivery too thank u so much ill be using this for cardio"
"1757","well received good quality and fast delivery overall satisfied"
"1758","good quality  feels very sturdy tried working out w it after it came it was amazing"
"1759","received in good condition plastic envelope from local seller in  days by singpost normal has yet to try "
"1760","you need to take note of the thickness so to sure to get what you need"
"1761","shipping took a week i really like this band and is perfect for my workout it is stretchable and wont snap easily would buy more "
"1762","works as advertised very pleased with the buy will purchase again "
"1763","bought the red and yellow one resistance is soso but band will ride up and twist by itself when you‚re exercising will not recommend "
"1764","good thank you"
"1765","fast delivery with good use the band tend to fold when exercise but if wearing tights there is no issues "
"1766","very good resistance esp the black one cant wait to use it quite fast delivery quality seems quite good too "
"1767","great material stretchy love the item worth the money and price "
"1768","order came shortly after ordering item is well packaged and delivered"
"1769","items came as described feels quite legit with very good tension its a good buy for the price "
"1770","received in two weeks times quality seems ok yet to try "
"1771","hope it lastdont break ok"
"1772","really good for shaping the hip muscles and   really stiff might not be suitable for hip thrusters"
"1773","good quality  smells a bit funny but that‚s expected "
"1774","rubber smell too strong "
"1775","not bad i tried it alr can feel the resistance and it seems quite durable  hopefully it will be during a workout too  but came quite fast  thanks "
"1776","fast delivery well received worth the money yet to try but the material is okay"
"1777","item received in order "
"1778","items received in good order tightness of respective bands is obvious"
"1779","its great "
"1780","received it safely took around  days havent try but looks okay "
"1781","received item as shown on picture bought during flash sale quick delivery "
"1782","very nice and stretchable hope it is durable and can last"
